{
  "eventId": "20000000-0000-4000-8000-000000000001",
  "eventType": "SpecificationPublished.v1",
  "schemaVersion": 1,
  "occurredAt": "2026-09-01T02:00:00Z",
  "producer": "specification-service",
  "organisationId": "supplier_01",
  "correlationId": "corr_seed_001",
  "aggregateId": "mat_001",
  "aggregateVersion": 1,
  "payload": {
    "organisationId": "supplier_01",
    "supplier": {
      "supplierId": "sup_001",
      "supplierCode": "COURSE-SUP-01",
      "supplierName": "Course cocoa supplier"
    },
    "material": {
      "materialId": "mat_001",
      "materialCode": "CHOC-BASE-01",
      "materialName": "Chocolate base"
    },
    "specificationVersion": {
      "id": "spec_001_v1",
      "versionNumber": 1
    },
    "previousVersion": null,
    "effectiveDate": "2026-09-01",
    "releasedAt": "2026-09-01T02:00:00Z",
    "components": [
      {
        "specComponentId": "spec_001_v1_c01",
        "sequenceNo": 1,
        "ingredientId": "ing_cocoa",
        "ingredientName": "cocoa",
        "rawPhrase": "cocoa mass",
        "matchStatus": "MATCHED"
      },
      {
        "specComponentId": "spec_001_v1_c02",
        "sequenceNo": 2,
        "ingredientId": "ing_wheat_flour",
        "ingredientName": "wheat flour",
        "rawPhrase": "wheat flour",
        "matchStatus": "MATCHED"
      }
    ],
    "provenance": {
      "provenanceId": "prov_project_seed",
      "sourceType": "PROJECT_SEEDED"
    }
  }
}
