{
  "eventId": "30000000-0000-4000-8000-000000000003",
  "eventType": "FormulaPublished.v1",
  "schemaVersion": 1,
  "occurredAt": "2026-10-06T02:00:00Z",
  "producer": "formulation-service",
  "organisationId": "manufacturer_01",
  "correlationId": "corr_004",
  "aggregateId": "prod_003",
  "aggregateVersion": 2,
  "payload": {
    "organisationId": "manufacturer_01",
    "product": { "productId": "prod_003", "productDescription": "Flavoured cereal bar" },
    "formulaVersion": { "id": "formula_003_v2", "versionNumber": 2 },
    "previousFormulaVersion": { "id": "formula_003_v1", "versionNumber": 1 },
    "releasedAt": "2026-10-06T02:00:00Z",
    "items": [
      { "formulaItemId": "formula_003_v2_i01", "sequenceNo": 1, "materialId": "mat_003", "specificationVersion": { "id": "spec_003_v2", "versionNumber": 2 }, "quantity": 2, "unit": "kg" },
      { "formulaItemId": "formula_003_v2_i02", "sequenceNo": 2, "materialId": "mat_004", "specificationVersion": { "id": "spec_004_v1", "versionNumber": 1 }, "quantity": 40, "unit": "kg" },
      { "formulaItemId": "formula_003_v2_i03", "sequenceNo": 3, "materialId": "mat_003", "specificationVersion": { "id": "spec_003_v2", "versionNumber": 2 }, "quantity": 0.5, "unit": "kg" }
    ],
    "provenance": { "provenanceId": "prov_project_seed", "sourceType": "PROJECT_SEEDED" }
  }
}
